{
  "interface_version": 1,
  "id": "example-batch",
  "purpose": "Implement the first issue of the example project.",
  "follows": null,
  "reason": "The first batch of this line of work. A later batch names the batch it stems from in follows and says here who decided what, and from which review or finding.",
  "from_issues": [],
  "project": "example",
  "issues": [
    "TEAM-123"
  ],
  "terminal_issue": "TEAM-123",
  "branch": "runner/example-batch",
  "worktree": "/absolute/path/to/prepared/worktree",
  "required_done": [],
  "supervision": {
    "stop_after": [],
    "on_block": "stop",
    "report_issues": [],
    "decision_rules": "honor",
    "baseline_checks": false
  },
  "context_controls": {
    "bounded_sessions": false,
    "low_risk_review": false,
    "compact_token_limit": null
  },
  "human_gates": []
}
